{
  "$schema": "https://json-schema.org/draft/2020-12/schema",
  "$id": "https://raw.githubusercontent.com/maurice-jobst/bembel-data/main/schemas/wasserhaeuschen.schema.json",
  "title": "Wasserhäuschen",
  "type": "object",
  "additionalProperties": false,
  "required": ["id", "name", "address", "latitude", "longitude", "sources", "verified"],
  "properties": {
    "id": {
      "type": "string",
      "pattern": "^[a-z0-9-]+$",
      "description": "Stable slug, matches the file name without .json"
    },
    "name": { "type": "string", "minLength": 1 },
    "address": {
      "type": "object",
      "additionalProperties": false,
      "required": ["street", "postalCode", "city"],
      "properties": {
        "street": { "type": "string", "description": "Street with house number where known" },
        "postalCode": { "type": "string", "pattern": "^[0-9]{5}$" },
        "city": { "type": "string" }
      }
    },
    "latitude": { "type": "number", "minimum": 49.5, "maximum": 50.8 },
    "longitude": { "type": "number", "minimum": 7.8, "maximum": 9.5 },
    "openingHours": {
      "type": "string",
      "description": "Free-form or OSM opening_hours syntax; omit when unknown"
    },
    "since": {
      "type": "integer",
      "minimum": 1850,
      "description": "Year the Häuschen (or current business) opened, when documented"
    },
    "features": {
      "type": "array",
      "items": {
        "enum": ["sitzplaetze", "eigenmarke", "kunst", "spaeti", "historisch", "trinkhalle-klassisch"]
      },
      "uniqueItems": true
    },
    "note": {
      "type": "string",
      "maxLength": 280,
      "description": "One neutral sentence of context. Facts, not marketing prose."
    },
    "sources": {
      "type": "array",
      "minItems": 1,
      "items": { "type": "string", "format": "uri" },
      "description": "Every entry names where its facts come from"
    },
    "verified": {
      "type": "boolean",
      "description": "true only after a maintainer checked the sources (or the place)"
    }
  }
}
